### ISSUE TITLE
Can't use session proxy in  its request for HTTPS protocol

### ISSUE THREAD

**Issue by Bl4ckc4t** [kennethreitz/requests#2911]
I've been struggling with my company proxy to make an https request.

import requests
from requests.auth import HTTPProxyAuth

proxy_string = 'http://user:password@url_proxt:port_proxy'

s = requests.Session()
s.proxies = {"http": proxy_string , "https": proxy_string}
s.auth = HTTPProxyAuth(user,password)

r = s.get('http://www.google.com') # OK
print(r.text)
r = s.get('https://www.google.com',proxies={"http": proxy_string , "https": proxy_string}) #OK
print(r.text)
r = s.get('https://www.google.com') # KO
print(r.text)

When KO, I have the following exception :

HTTPSConnectionPool(host='www.google.com', port=443): Max retries exceeded with url: / (Caused by ProxyError('Cannot connect to proxy.', OSError('Tunnel connection failed: 407 Proxy Authentication Required',)))

I looked online but didn't find someone having this specific issue with HTTPS.

Thank you for your time

Description of issue here :
http://stackoverflow.com/questions/34025964/python-requests-api-using-proxy-for-https-request-get-407-proxy-authentication-r

**Comment by Lukasa** [comment]
Have you tried the same request without setting `s.auth`?

**Comment by FabriceSh44** [comment]
Just did. Same result : KO

**Comment by Lukasa** [comment]
Hmm. I wonder if this is connection pooling related. @Bl4ckc4t, are you comfortable with wireshark?

**Comment by FabriceSh44** [comment]
I would like to avoid that. Being in a corporate environment and not knowing Wireshark that well, I'm afraid to transmit info of my company that will most probably get me fired. Is there any other way? 
Would it be possible for example to transmit by default in the code the session proxies setup like I did in example 2 to the session.get() requests ?

**Comment by Lukasa** [comment]
@Bl4ckc4t What I'm worried about is that this may be interacting with our connection re-use logic. This seems the most likely cause of the problem.

**Comment by FabriceSh44** [comment]
Can you tell me what you are looking for in the wireshark capture and I will try to get it for you without the dump - if you think it's possible.

**Comment by Lukasa** [comment]
I'm interested to see, in the case of the second request, whether a new TCP connection and CONNECT request are made or whether we re-use the old one. If a new one is made, I want to see if it has the Proxy-Authorization header in place.

**Comment by FabriceSh44** [comment]
On the second request, an new tcp connection is made (I guessed that because it uses another port). Inside the Hypertext Transfer Protocol, the proxy authorization header is correctly set. I looked at the third one and it doesn't contain it.

**Comment by Lukasa** [comment]
@Bl4ckc4t Does the third one use a new TCP connection, or the same one?

**Comment by FabriceSh44** [comment]
New one.

**Comment by Lukasa** [comment]
Ok, so that's interesting. What version of requests are you using and where did you get it?

**Comment by FabriceSh44** [comment]
requests==2.8.1 on Windows.
Don't remember installing it specifically so I guess I got it either from python 3.4 installation or with a pip install that had this module as dependency.

**Comment by Lukasa** [comment]
So, I think the issue here is that we're not correct re-applying the proxy headers in this case.

**Comment by FabriceSh44** [comment]
My real issue is that I'm using a library using this mechanism and failing to request. I can't change s.get(url) to s.get(url,proxy). Do you see any workaround where I would change the session object state in order to force proxy usage at every request of this session ? If not, I will wait for the fix. 

In any case, thank you very much for the time you spend on this issue.

**Comment by Lukasa** [comment]
Wait, @Bl4ckc4t, my understanding is that you _are_ using the `Session` each time, we're just not correctly attaching the headers. You can actually temporarily fix this problem by not using a `Session`.

I'm trying to get an exact reproduction of this problem on my own system. Right now, I'm getting connections that correctly re-use the established tunnel, which is not quite right.

**Comment by FabriceSh44** [comment]
I'm actually using this library : https://pypi.python.org/pypi/jira
JIRA contructor create a session and following request on its object only use get method.
I'm not able (at least I don't know how) to change the implementation, switching from Session to Request or set the proxy at each session request.

**Comment by Lukasa** [comment]
@Bl4ckc4t Can you check whether the response to the second request sends the `Connection` header, and if so, to what value? I'm trying to work out why the connection is going away.

**Comment by Lukasa** [comment]
So far, I'm unable to reproduce this: the new TCP connections correctly have the Proxy-Authorization header set.

**Comment by FabriceSh44** [comment]
Here is the overview of the dump.

"Protocol","No.","Info"
"HTTP","106","Continuation or non-HTTP traffic"
"TCP","163","55638 > http-alt [SYN] Seq=0 Win=8192 Len=0 MSS=1460 WS=8 SACK_PERM=1"
"TCP","166","55638 > http-alt [ACK] Seq=1 Ack=1 Win=64860 Len=0"
"HTTP","167","GET http://www.google.com/ HTTP/1.1 "
"TCP","172","55638 > http-alt [ACK] Seq=215 Ack=4081 Win=64860 Len=0"
"TCP","177","55638 > http-alt [ACK] Seq=215 Ack=8220 Win=64860 Len=0"
"TCP","178","53650 > http-alt [ACK] Seq=1 Ack=61 Win=64380 Len=0"
,"TCP","506","[TCP Keep-Alive] 55636 > http-alt [ACK] Seq=1 Ack=1 Win=64860 Len=1"
,"TCP","607","[TCP Keep-Alive] 55636 > http-alt [ACK] Seq=1 Ack=1 Win=64860 Len=1"
,"TCP","624","55651 > http-alt [SYN] Seq=0 Win=8192 Len=0 MSS=1460 WS=8 SACK_PERM=1"
,"TCP","626","55651 > http-alt [ACK] Seq=1 Ack=1 Win=64860 Len=0"
,"HTTP","627","GET http://www.google.com/ HTTP/1.1 "
,"TCP","634","55651 > http-alt [ACK] Seq=509 Ack=5489 Win=64860 Len=0"
,"TCP","637","55651 > http-alt [ACK] Seq=509 Ack=7652 Win=64860 Len=0"
,"HTTP","798","Continuation or non-HTTP traffic"
,"HTTP","799","Continuation or non-HTTP traffic"
,"TCP","803","53650 > http-alt [ACK] Seq=296 Ack=337 Win=64104 Len=0"
,"TCP","819","[TCP Keep-Alive] 55636 > http-alt [ACK] Seq=1 Ack=1 Win=64860 Len=1"
,"TCP","1015","55653 > http-alt [SYN] Seq=0 Win=8192 Len=0 MSS=1460 WS=8 SACK_PERM=1"
,"TCP","1017","55653 > http-alt [ACK] Seq=1 Ack=1 Win=64860 Len=0"
,"TCP","1018","[TCP segment of a reassembled PDU]"
,"HTTP","1021","CONNECT www.google.com:443 HTTP/1.0 "
,"TCP","1024","55653 > http-alt [ACK] Seq=40 Ack=1125 Win=63737 Len=0"
,"TCP","1372","[TCP Keep-Alive] 55636 > http-alt [ACK] Seq=1 Ack=1 Win=64860 Len=1"

Breakpoint before request 2 : packet number 178
Breakpoint before request 3 : packet number 637

No proxy auth on 1021
Proxy auth on 167 and 627

i filtered on my ip and ip dest.

Which packet number do you want me to check connection header?

**Comment by Lukasa** [comment]
Hang on, hang on.

I see two HTTP requests here, and one HTTPS, but your code above makes two HTTPS requests and one HTTP. Are you sure this behaviour is right? Did the first request get redirected? (e.g. what's the value of r.history for the first request)

**Comment by FabriceSh44** [comment]
Right, sorry, I messed up my test when rebuild it (lost it by mistake), let me make you a new one.

**Comment by FabriceSh44** [comment]
So new one :

"Protocol","No.","Info"
"TCP","9496","62863 > http-alt [SYN] Seq=0 Win=8192 Len=0 MSS=1460 WS=8 SACK_PERM=1"
"TCP","9498","62863 > http-alt [ACK] Seq=1 Ack=1 Win=64860 Len=0"
"HTTP","9499","GET http://ctldl.windowsupdate.com/msdownload/update/v3/static/trustedr/en/disallowedcertstl.cab?248b33e67353bb0c HTTP/1.1 "
"TCP","9502","62863 > http-alt [ACK] Seq=238 Ack=1209 Win=63653 Len=0"
"TCP","9503","62863 > http-alt [FIN, ACK] Seq=238 Ack=1209 Win=63653 Len=0"
"TCP","9504","62864 > http-alt [SYN] Seq=0 Win=8192 Len=0 MSS=1460 WS=8 SACK_PERM=1"
"TCP","9507","62864 > http-alt [ACK] Seq=1 Ack=1 Win=64860 Len=0"
"TCP","9508","[TCP segment of a reassembled PDU]"
"TCP","9509","[TCP segment of a reassembled PDU]"
"TCP","9512","[TCP segment of a reassembled PDU]"
"TCP","9513","[TCP segment of a reassembled PDU]"
"TCP","9514","[TCP segment of a reassembled PDU]"
"HTTP","9515","GET http://ctldl.windowsupdate.com/msdownload/update/v3/static/trustedr/en/disallowedcertstl.cab?248b33e67353bb0c HTTP/1.1 "
"TCP","9624","[TCP ACKed lost segment] 62864 > http-alt [FIN, ACK] Seq=7643 Ack=957 Win=63905 Len=0"
"TCP","16269","62865 > http-alt [SYN] Seq=0 Win=8192 Len=0 MSS=1460 WS=8 SACK_PERM=1"
"TCP","16271","62865 > http-alt [ACK] Seq=1 Ack=1 Win=64860 Len=0"
"HTTP","16272","GET http://www.google.com/ HTTP/1.1 "
"TCP","16743","62865 > http-alt [ACK] Seq=215 Ack=4081 Win=64860 Len=0"
"TCP","16748","62865 > http-alt [ACK] Seq=215 Ack=8224 Win=64860 Len=0"
"TCP","52594","62866 > http-alt [SYN] Seq=0 Win=8192 Len=0 MSS=1460 WS=8 SACK_PERM=1"
"TCP","52596","62866 > http-alt [ACK] Seq=1 Ack=1 Win=64860 Len=0"
"TCP","52597","[TCP segment of a reassembled PDU]"
"HTTP","52606","CONNECT www.google.com:443 HTTP/1.0 "
"TCP","53070","62866 > http-alt [ACK] Seq=89 Ack=40 Win=64821 Len=0"
"TLSv1.2","54122","Client Hello"
"TCP","54128","62866 > http-alt [ACK] Seq=606 Ack=3541 Win=64860 Len=0"
"TLSv1.2","54129","Client Key Exchange, Change Cipher Spec, Encrypted Handshake Message"
"TLSv1.2","54131","Application Data"
"TCP","54338","62866 > http-alt [ACK] Seq=1247 Ack=11763 Win=64860 Len=0"
"HTTP","66776","Continuation or non-HTTP traffic"
"TCP","82001","62868 > http-alt [SYN] Seq=0 Win=8192 Len=0 MSS=1460 WS=8 SACK_PERM=1"
"TCP","82003","62868 > http-alt [ACK] Seq=1 Ack=1 Win=64860 Len=0"
"TCP","82004","[TCP segment of a reassembled PDU]"
"HTTP","82312","CONNECT www.google.com:443 HTTP/1.0 "
"TCP","82365","62868 > http-alt [ACK] Seq=40 Ack=1125 Win=63737 Len=0"

Breakpoint before request 2 : packet number 16748
Breakpoint before request 3 : packet number 54338

**Comment by Lukasa** [comment]
And, again, to clarify: the third request for google.com is the one that has no Proxy-Authorization header?

**Comment by FabriceSh44** [comment]
3rd request , packet 82312 -  no Proxy Authorization Header
packets 52606 and 16272 have it .

**Comment by Lukasa** [comment]
hmm. That's interesting: it doesn't look like the connection is being closed, but it's not available to the pool either.

Can you verify something for me: can you right-click on each of the new SYNs that contain requests and hit "follow TCP stream"? Just check that the Proxy-Authorization header didn't come in a later packet, because it does on my machine.

**Comment by FabriceSh44** [comment]
1st SYN TCP Stream :
GET http://www.google.com/ HTTP/1.1
Host: www.google.com
Connection: keep-alive
Accept-Encoding: gzip, deflate
Accept: _/_
Proxy-Authorization: [Id1]
User-Agent: python-requests/2.8.1

HTTP/1.1 200 OK
Headers data

BINARY

---

2nd SYN TCP Stream :
CONNECT www.google.com:443 HTTP/1.0
Proxy-Authorization: [Id1]
HTTP/1.1 200 Connection established

BINARY

---

3rd SYN TCP Stream:
CONNECT www.google.com:443 HTTP/1.0
HTTP/1.1 407 Proxy Authentication Required

Header on authentification

HTML code showing our access denied page

**Comment by Lukasa** [comment]
Hmm. Right now I'm totally short on exactly why this is happening. The TCP stream for the second response: does it get terminated? (RST or FIN packets)

**Comment by FabriceSh44** [comment]
Don't see anything like that.

**Comment by Lukasa** [comment]
So, my question is why there's a second connection at all. If the connection is still up, there's no reason for us to have thrown it away as far as I can tell. I'm extremely perplexed as to why the connection is not being re-used. With the proxy I have on my local machine (Charles Proxy), we quite happily re-use that same TCP connection, and if we _don't_ re-use it (because it got torn down) we create a new one with the new headers.

For some insane reason, one part of requests believes that the old connection is still being used, and another part believes that it's not, and I'm not sure why yet.

I'm going to take a quick look at Python 3.4's `http.client` module to see if I can find anything in there that would cause this.

**Comment by Lukasa** [comment]
I cannot see anything that immediately suggests that this problem would occur. Only if a second call to `set_tunnel` was made, somehow losing the headers, would that occur. Unfortunately, without a reproduction scenario that I can reach it's likely to be quite tricky to trace this problem.

It would be interesting if you could confirm that we never call `http.client.HTTPConnection.set_tunnel` twice on a connection (e.g. by adjusting your local copy to assert that `self._tunnel_host` is always `None` when called. That would be a start.

**Comment by FabriceSh44** [comment]
Set_tunnel is called for request 2 and 3 (not 1).

Call stack
    set_tunnel in client line 771   Python
        _prepare_proxy in connectionpool line 746   Python
    urlopen in connectionpool line 554  Python
    send in adapters line 370   Python
    send in sessions line 576   Python
    request in sessions line 468    Python
    get in sessions line 480    Python

**Comment by FabriceSh44** [comment]
HTTPConnection pool doesn't do anything when _prepare_proxy, keeping the proxy. HTTPSConnectionPool will call set tunnel every time.

**Comment by Lukasa** [comment]
Yeah, that's all as expected.

Can you confirm that, for the second request, set_tunnel is called with the appropriate proxy headers?

**Comment by FabriceSh44** [comment]
request 2 : self.proxy_headers == {'Proxy-Authorization': [Id1]}
request 3 : self.proxy_headers == {}

**Comment by FabriceSh44** [comment]
Additional info, if i comment :
#s.proxies = {"http": proxy_string , "https": proxy_string}
then request 1 is still working, maybe my proxy doesn't filter http on google

So my guess is proxy info are correctly retrieved from the session proxies but it's good when it's from session.get() argument proxies.

**Comment by FabriceSh44** [comment]
I think i found the issue. It's in 
merge_setting
def merge_setting(request_setting, session_setting, dict_class=OrderedDict).

In input I have request_setting and session_setting. 
Session_setting has http://user:password@url_proxy:port_proxy (OK)
Request_setting has http://url_proxy:port_proxy (won't be able to authenticate, was guessed from the environment)
After  :
merged_setting.update(to_key_val_list(request_setting)) 
it gets the request setting in the merged setting which is wrong.

**Comment by Lukasa** [comment]
In the third case there should be no request setting at all as you didn't set one. Do you have the `HTTPS_PROXY` environment variable set?

**Comment by Bl4ckc4t** [comment]
Oh. Yes I do . I needed it for pip install the library..

**Comment by FabriceSh44** [comment]
I thought I did, but it's not there anymore as I restarted my workstation. In the mean time, I deactivated trust_env and it works.

**Comment by Lukasa** [comment]
Hurrah! Here we are. For the future, you can put the auth credentials in the `HTTPS_PROXY` environment variable, which will save you this pain.
